{
  "id": "effectcraft/titles/title",
  "name": "Title",
  "version": "1.1.0",
  "app": "effectcraft",
  "app_min_version": "0.13.0",
  "built_with": "0.13.0",
  "tested": [
    {
      "version": "0.13.0",
      "date": "2026-10-22",
      "result": "pass",
      "checks": "41/41"
    },
    {
      "version": "0.14.0",
      "date": "2026-10-22",
      "result": "pass",
      "checks": "41/41"
    }
  ],
  "kind": "motion",
  "category": "titles",
  "description": "A title line with an optional small spaced-out label over it, in the centre, bottom centre or a corner; fades and rises in.",
  "duration_seconds": 5,
  "fps": 24,
  "variants": [
    {
      "key": "16x9",
      "size": [
        1920,
        1080
      ],
      "file": "templates/title_16x9.ectemplate",
      "output": "prores4444"
    },
    {
      "key": "9x16",
      "size": [
        1080,
        1920
      ],
      "file": "templates/title_9x16.ectemplate",
      "output": "prores4444"
    }
  ],
  "controls": [
    {
      "name": "Title",
      "type": "text",
      "default": "Our Road Trip"
    },
    {
      "name": "Label",
      "type": "text",
      "default": "Australia",
      "description": "Small line over the title, in spaced-out capitals; leave empty for none."
    },
    {
      "name": "Title Font",
      "type": "font",
      "default": "Inter Bold"
    },
    {
      "name": "Label Font",
      "type": "font",
      "default": "Inter SemiBold"
    },
    {
      "name": "Place",
      "type": "dropdown",
      "options": [
        "Centre",
        "Bottom Centre",
        "Bottom Left",
        "Bottom Right",
        "Top Left",
        "Top Right"
      ],
      "default": "Centre"
    },
    {
      "name": "Margin",
      "type": "number",
      "default": 96,
      "description": "Distance from the frame's edges for every Place but Centre, in pixels (9x16: 80)."
    },
    {
      "name": "Extra Vertical",
      "type": "number",
      "default": 0,
      "description": "Added to Margin at the top and bottom, and half of it lifts a Centre title, as a percent of the frame height (0 in 16x9, 8.3 in 9x16, 160 px: clear of a phone's status bar, channel row and like button)."
    },
    {
      "name": "Extra Right",
      "type": "number",
      "default": 0,
      "description": "Added to Margin at the right edge, as a percent of the frame width (0 in 16x9, 13 in 9x16, 140 px: clear of a phone's Shorts buttons)."
    },
    {
      "name": "Max Width",
      "type": "number",
      "default": 86,
      "description": "Widest either line may be, in % of the frame width; a wider line shrinks to fit."
    },
    {
      "name": "Colour",
      "type": "color",
      "default": "#ffffff"
    },
    {
      "name": "Shadow",
      "type": "number",
      "default": 50,
      "description": "Strength of the soft shadow under the text, 0 to 100."
    },
    {
      "name": "Fade",
      "type": "dropdown",
      "options": [
        "Fade In and Out",
        "Fade In",
        "Steady",
        "Fade Out"
      ],
      "default": "Fade In and Out",
      "description": "Fade In (then full to the end), Steady (full throughout) or Fade Out (full from the first frame), to hold a title across several clips."
    },
    {
      "name": "Start",
      "type": "number",
      "default": 0.3,
      "description": "When it starts to fade and rise in, in seconds (0.6 s in); not used by Steady and Fade Out."
    },
    {
      "name": "Duration",
      "type": "number",
      "default": 5,
      "description": "Length of the rendered clip in seconds; with Fade In and Out or Fade Out it fades out over its last 0.5 s."
    }
  ],
  "fonts": [
    "Inter"
  ],
  "tags": [
    "title",
    "opening",
    "caption",
    "label",
    "text"
  ]
}
