{
  "id": "effectcraft/titles/sign_off",
  "name": "Sign-off",
  "version": "1.1.0",
  "app": "effectcraft",
  "app_min_version": "0.13.0",
  "built_with": "0.13.0",
  "tested": [
    {
      "version": "0.13.0",
      "date": "2026-10-21",
      "result": "pass",
      "checks": "32/32"
    }
  ],
  "kind": "motion",
  "category": "titles",
  "description": "One line such as “Thank you for watching” between two hearts that follow its width; fades in, hearts pop.",
  "duration_seconds": 5,
  "fps": 24,
  "variants": [
    {
      "key": "16x9",
      "size": [
        1920,
        1080
      ],
      "file": "templates/sign_off_16x9.ectemplate",
      "output": "prores4444"
    },
    {
      "key": "9x16",
      "size": [
        1080,
        1920
      ],
      "file": "templates/sign_off_9x16.ectemplate",
      "output": "prores4444"
    }
  ],
  "controls": [
    {
      "name": "Text",
      "type": "text",
      "default": "Thank you for watching"
    },
    {
      "name": "Font",
      "type": "font",
      "default": "Montserrat Medium"
    },
    {
      "name": "Position",
      "type": "point",
      "default": [
        960,
        790
      ],
      "description": "Centre of the row, in frame pixels (9x16: [540, 1160]); below the Credits block by default."
    },
    {
      "name": "Max Width",
      "type": "number",
      "default": 1651,
      "description": "Widest the row (hearts included) may be, in pixels (9x16: 929); a longer one shrinks to fit."
    },
    {
      "name": "Text Colour",
      "type": "color",
      "default": "#ffffff"
    },
    {
      "name": "Heart Colour",
      "type": "color",
      "default": "#e5484d"
    },
    {
      "name": "Heart Size",
      "type": "number",
      "default": 70,
      "description": "Width of each heart, in % of the font size."
    },
    {
      "name": "Shadow",
      "type": "number",
      "default": 50,
      "description": "Strength of the soft shadow, 0 to 100."
    },
    {
      "name": "Blink",
      "type": "checkbox",
      "default": false,
      "description": "The hearts beat: once popped in, fully on and off together, on for 60 % of each beat."
    },
    {
      "name": "Beats per Minute",
      "type": "number",
      "default": 70,
      "description": "How fast the hearts beat with Blink on."
    },
    {
      "name": "Start",
      "type": "number",
      "default": 0.6,
      "description": "When the text starts to fade and rise in, in seconds; the hearts pop in 0.25 s later."
    },
    {
      "name": "Duration",
      "type": "number",
      "default": 5,
      "description": "Length of the rendered clip in seconds; it fades out over its last 0.5 s."
    }
  ],
  "fonts": [
    "Montserrat"
  ],
  "tags": [
    "sign-off",
    "thank you",
    "end card",
    "outro",
    "hearts"
  ]
}
